{
  "schema_version": "0.1.0",
  "command_name": "placeholder_command",
  "retrieval_status": "found_complete",
  "source_authority": "official_docs",
  "source_type": "official_local_rst",
  "confidence": 1.0,
  "matches": [
    {
      "command_name": "placeholder_command",
      "file_path": "command-reference/placeholder_command.rst",
      "heading": "placeholder_command",
      "source_type": "official_local_rst",
      "source_authority": "official_docs",
      "confidence": 1.0,
      "match_reason": [
        "schema validation fixture"
      ],
      "syntax_blocks": [
        "placeholder_command(...)"
      ],
      "inputs_section": "Placeholder fixture text. This is not GAUSS documentation.",
      "outputs_section": "Placeholder fixture text. This is not GAUSS documentation.",
      "returns_section": null,
      "controls_section": null,
      "formula_section": null,
      "examples": [],
      "notes": [
        "Artificial schema validation fixture only; not verified GAUSS command behavior."
      ],
      "keyword_hits": {},
      "related_links": [],
      "raw_section_headings": [
        "placeholder_command"
      ],
      "unresolved_questions": [],
      "extraction_warnings": []
    }
  ],
  "unresolved_questions": [],
  "extraction_warnings": [],
  "generated_at": "2026-07-04T00:00:00Z",
  "tool_name": "schema-fixture",
  "tool_version": "0.1.0",
  "docs_root_redacted": true,
  "best_match": {
    "command_name": "placeholder_command",
    "file_path": "command-reference/placeholder_command.rst",
    "heading": "placeholder_command",
    "source_type": "official_local_rst",
    "source_authority": "official_docs",
    "confidence": 1.0,
    "match_reason": [
      "schema validation fixture"
    ],
    "syntax_blocks": [
      "placeholder_command(...)"
    ],
    "inputs_section": "Placeholder fixture text. This is not GAUSS documentation.",
    "outputs_section": "Placeholder fixture text. This is not GAUSS documentation.",
    "returns_section": null,
    "controls_section": null,
    "formula_section": null,
    "examples": [],
    "notes": [
      "Artificial schema validation fixture only; not verified GAUSS command behavior."
    ],
    "keyword_hits": {},
    "related_links": [],
    "raw_section_headings": [
      "placeholder_command"
    ],
    "unresolved_questions": [],
    "extraction_warnings": []
  },
  "ambiguity": null,
  "conflicts": [],
  "stale_evidence": null,
  "notes": [
    "Artificial schema validation fixture only; not verified GAUSS command behavior."
  ]
}
